{
  "$schema": "../schema/test-case.schema.json",
  "formatVersion": 1,
  "planSnapshotDate": "2026-10-23",
  "money": "integer pence unless a field says otherwise",
  "cases": [
    {
      "id": "round-positive-just-below-half",
      "description": "Round 0.4999p to whole pence (just below half, positive).",
      "rule": {
        "source": "Decisions 0021 (nearest penny, half away from zero; each line rounded once; total is the sum of rounded lines) and 0034 (boundary table)",
        "url": "docs/decisions/0034-rounding-boundary-cases.md"
      },
      "inputs": {
        "unroundedPence": "0.4999",
        "testOnly": true
      },
      "steps": [
        {
          "n": 1,
          "description": "Nearest penny, half away from zero: 0.4999p",
          "valuePence": 0,
          "rounding": "once, half away from zero"
        }
      ],
      "expected": {
        "pence": 0
      }
    },
    {
      "id": "round-positive-exactly-half",
      "description": "Round 0.5p to whole pence (exactly half, positive).",
      "rule": {
        "source": "Decisions 0021 (nearest penny, half away from zero; each line rounded once; total is the sum of rounded lines) and 0034 (boundary table)",
        "url": "docs/decisions/0034-rounding-boundary-cases.md"
      },
      "inputs": {
        "unroundedPence": "0.5",
        "testOnly": true
      },
      "steps": [
        {
          "n": 1,
          "description": "Nearest penny, half away from zero: 0.5p",
          "valuePence": 1,
          "rounding": "once, half away from zero"
        }
      ],
      "expected": {
        "pence": 1
      }
    },
    {
      "id": "round-positive-just-above-half",
      "description": "Round 0.5001p to whole pence (just above half, positive).",
      "rule": {
        "source": "Decisions 0021 (nearest penny, half away from zero; each line rounded once; total is the sum of rounded lines) and 0034 (boundary table)",
        "url": "docs/decisions/0034-rounding-boundary-cases.md"
      },
      "inputs": {
        "unroundedPence": "0.5001",
        "testOnly": true
      },
      "steps": [
        {
          "n": 1,
          "description": "Nearest penny, half away from zero: 0.5001p",
          "valuePence": 1,
          "rounding": "once, half away from zero"
        }
      ],
      "expected": {
        "pence": 1
      }
    },
    {
      "id": "round-negative-just-below-half",
      "description": "Round -0.4999p to whole pence (just below half, negative).",
      "rule": {
        "source": "Decisions 0021 (nearest penny, half away from zero; each line rounded once; total is the sum of rounded lines) and 0034 (boundary table)",
        "url": "docs/decisions/0034-rounding-boundary-cases.md"
      },
      "inputs": {
        "unroundedPence": "-0.4999",
        "testOnly": true
      },
      "steps": [
        {
          "n": 1,
          "description": "Nearest penny, half away from zero: -0.4999p",
          "valuePence": 0,
          "rounding": "once, half away from zero"
        }
      ],
      "expected": {
        "pence": 0
      }
    },
    {
      "id": "round-negative-exactly-half",
      "description": "Round -0.5p to whole pence (exactly half, negative).",
      "rule": {
        "source": "Decisions 0021 (nearest penny, half away from zero; each line rounded once; total is the sum of rounded lines) and 0034 (boundary table)",
        "url": "docs/decisions/0034-rounding-boundary-cases.md"
      },
      "inputs": {
        "unroundedPence": "-0.5",
        "testOnly": true
      },
      "steps": [
        {
          "n": 1,
          "description": "Nearest penny, half away from zero: -0.5p",
          "valuePence": -1,
          "rounding": "once, half away from zero"
        }
      ],
      "expected": {
        "pence": -1
      }
    },
    {
      "id": "round-negative-just-above-half",
      "description": "Round -0.5001p to whole pence (just above half, negative).",
      "rule": {
        "source": "Decisions 0021 (nearest penny, half away from zero; each line rounded once; total is the sum of rounded lines) and 0034 (boundary table)",
        "url": "docs/decisions/0034-rounding-boundary-cases.md"
      },
      "inputs": {
        "unroundedPence": "-0.5001",
        "testOnly": true
      },
      "steps": [
        {
          "n": 1,
          "description": "Nearest penny, half away from zero: -0.5001p",
          "valuePence": -1,
          "rounding": "once, half away from zero"
        }
      ],
      "expected": {
        "pence": -1
      }
    },
    {
      "id": "annual-to-monthly-pos-5",
      "description": "Convert 5p a year to a monthly amount: 5/12 = 0.41667p, below half",
      "rule": {
        "source": "Decisions 0021 (nearest penny, half away from zero; each line rounded once; total is the sum of rounded lines) and 0034 (boundary table)",
        "url": "docs/decisions/0034-rounding-boundary-cases.md"
      },
      "inputs": {
        "annualPence": 5,
        "testOnly": true
      },
      "steps": [
        {
          "n": 1,
          "description": "5 / 12",
          "valueExact": "0.41666667",
          "rounding": "none"
        },
        {
          "n": 2,
          "description": "Round once to the penny, half away from zero",
          "valuePence": 0,
          "rounding": "once, half away from zero"
        }
      ],
      "expected": {
        "monthlyPence": 0
      }
    },
    {
      "id": "annual-to-monthly-neg-5",
      "description": "Convert -5p a year to a monthly amount: 5/12 = 0.41667p, below half (negated)",
      "rule": {
        "source": "Decisions 0021 (nearest penny, half away from zero; each line rounded once; total is the sum of rounded lines) and 0034 (boundary table)",
        "url": "docs/decisions/0034-rounding-boundary-cases.md"
      },
      "inputs": {
        "annualPence": -5,
        "testOnly": true
      },
      "steps": [
        {
          "n": 1,
          "description": "-5 / 12",
          "valueExact": "-0.41666667",
          "rounding": "none"
        },
        {
          "n": 2,
          "description": "Round once to the penny, half away from zero",
          "valuePence": 0,
          "rounding": "once, half away from zero"
        }
      ],
      "expected": {
        "monthlyPence": 0
      }
    },
    {
      "id": "annual-to-monthly-pos-6",
      "description": "Convert 6p a year to a monthly amount: 6/12 = 0.5p, exactly half",
      "rule": {
        "source": "Decisions 0021 (nearest penny, half away from zero; each line rounded once; total is the sum of rounded lines) and 0034 (boundary table)",
        "url": "docs/decisions/0034-rounding-boundary-cases.md"
      },
      "inputs": {
        "annualPence": 6,
        "testOnly": true
      },
      "steps": [
        {
          "n": 1,
          "description": "6 / 12",
          "valueExact": "0.5",
          "rounding": "none"
        },
        {
          "n": 2,
          "description": "Round once to the penny, half away from zero",
          "valuePence": 1,
          "rounding": "once, half away from zero"
        }
      ],
      "expected": {
        "monthlyPence": 1
      }
    },
    {
      "id": "annual-to-monthly-neg-6",
      "description": "Convert -6p a year to a monthly amount: 6/12 = 0.5p, exactly half (negated)",
      "rule": {
        "source": "Decisions 0021 (nearest penny, half away from zero; each line rounded once; total is the sum of rounded lines) and 0034 (boundary table)",
        "url": "docs/decisions/0034-rounding-boundary-cases.md"
      },
      "inputs": {
        "annualPence": -6,
        "testOnly": true
      },
      "steps": [
        {
          "n": 1,
          "description": "-6 / 12",
          "valueExact": "-0.5",
          "rounding": "none"
        },
        {
          "n": 2,
          "description": "Round once to the penny, half away from zero",
          "valuePence": -1,
          "rounding": "once, half away from zero"
        }
      ],
      "expected": {
        "monthlyPence": -1
      }
    },
    {
      "id": "annual-to-monthly-pos-7",
      "description": "Convert 7p a year to a monthly amount: 7/12 = 0.58333p, above half",
      "rule": {
        "source": "Decisions 0021 (nearest penny, half away from zero; each line rounded once; total is the sum of rounded lines) and 0034 (boundary table)",
        "url": "docs/decisions/0034-rounding-boundary-cases.md"
      },
      "inputs": {
        "annualPence": 7,
        "testOnly": true
      },
      "steps": [
        {
          "n": 1,
          "description": "7 / 12",
          "valueExact": "0.58333333",
          "rounding": "none"
        },
        {
          "n": 2,
          "description": "Round once to the penny, half away from zero",
          "valuePence": 1,
          "rounding": "once, half away from zero"
        }
      ],
      "expected": {
        "monthlyPence": 1
      }
    },
    {
      "id": "annual-to-monthly-neg-7",
      "description": "Convert -7p a year to a monthly amount: 7/12 = 0.58333p, above half (negated)",
      "rule": {
        "source": "Decisions 0021 (nearest penny, half away from zero; each line rounded once; total is the sum of rounded lines) and 0034 (boundary table)",
        "url": "docs/decisions/0034-rounding-boundary-cases.md"
      },
      "inputs": {
        "annualPence": -7,
        "testOnly": true
      },
      "steps": [
        {
          "n": 1,
          "description": "-7 / 12",
          "valueExact": "-0.58333333",
          "rounding": "none"
        },
        {
          "n": 2,
          "description": "Round once to the penny, half away from zero",
          "valuePence": -1,
          "rounding": "once, half away from zero"
        }
      ],
      "expected": {
        "monthlyPence": -1
      }
    },
    {
      "id": "annual-to-monthly-pos-18",